{
  "$schema": "https://json-schema.org/draft/2020-12/schema",
  "$id": "https://example.invalid/ldgm/test_goal.schema.json",
  "title": "LDGM Tranche Test Goal",
  "type": "object",
  "additionalProperties": false,
  "required": [
    "schema_version",
    "source_specification",
    "tranche_id",
    "title",
    "phase",
    "mvp",
    "purpose",
    "dependencies",
    "entry_criteria",
    "non_goals",
    "test_environment",
    "goals",
    "exit_gate"
  ],
  "properties": {
    "schema_version": {
      "const": "1.0"
    },
    "source_specification": {
      "type": "string",
      "minLength": 1
    },
    "tranche_id": {
      "type": "string",
      "pattern": "^T[0-9]+$"
    },
    "title": {
      "type": "string",
      "minLength": 1
    },
    "phase": {
      "type": "string",
      "minLength": 1
    },
    "mvp": {
      "type": "boolean"
    },
    "purpose": {
      "type": "string",
      "minLength": 1
    },
    "dependencies": {
      "type": "array",
      "items": {
        "type": "string",
        "pattern": "^T[0-9]+$"
      },
      "uniqueItems": true
    },
    "entry_criteria": {
      "type": "array",
      "items": {
        "type": "string",
        "minLength": 1
      },
      "minItems": 1
    },
    "non_goals": {
      "type": "array",
      "items": {
        "type": "string",
        "minLength": 1
      }
    },
    "test_environment": {
      "type": "object",
      "additionalProperties": false,
      "required": [
        "build_configuration",
        "topology",
        "required_assets"
      ],
      "properties": {
        "build_configuration": {
          "type": "array",
          "items": {
            "type": "string"
          },
          "minItems": 1
        },
        "topology": {
          "type": "array",
          "items": {
            "type": "string"
          },
          "minItems": 1
        },
        "required_assets": {
          "type": "array",
          "items": {
            "type": "string"
          }
        },
        "network_profiles": {
          "type": "array",
          "items": {
            "type": "string"
          }
        },
        "notes": {
          "type": "array",
          "items": {
            "type": "string"
          }
        }
      }
    },
    "goals": {
      "type": "array",
      "minItems": 1,
      "items": {
        "type": "object",
        "additionalProperties": false,
        "required": [
          "id",
          "category",
          "priority",
          "statement",
          "method",
          "procedure",
          "assertions",
          "evidence"
        ],
        "properties": {
          "id": {
            "type": "string",
            "pattern": "^T[0-9]+-[A-Z0-9]+-[0-9]{3}$"
          },
          "category": {
            "enum": [
              "build",
              "physics",
              "camera",
              "input",
              "combat",
              "damage",
              "mission",
              "ui",
              "persistence",
              "network",
              "security",
              "performance",
              "content",
              "economy",
              "reliability"
            ]
          },
          "priority": {
            "enum": [
              "blocker",
              "critical",
              "major",
              "minor"
            ]
          },
          "statement": {
            "type": "string",
            "minLength": 1
          },
          "method": {
            "enum": [
              "automated",
              "instrumented",
              "manual",
              "mixed"
            ]
          },
          "procedure": {
            "type": "array",
            "items": {
              "type": "string",
              "minLength": 1
            },
            "minItems": 1
          },
          "assertions": {
            "type": "array",
            "minItems": 1,
            "items": {
              "type": "object",
              "additionalProperties": false,
              "required": [
                "metric",
                "operator",
                "target"
              ],
              "properties": {
                "metric": {
                  "type": "string",
                  "minLength": 1
                },
                "operator": {
                  "enum": [
                    "==",
                    "!=",
                    "<",
                    "<=",
                    ">",
                    ">=",
                    "contains",
                    "not_contains",
                    "in_range",
                    "all_pass"
                  ]
                },
                "target": {},
                "unit": {
                  "type": "string"
                },
                "tolerance": {
                  "type": [
                    "number",
                    "null"
                  ]
                },
                "notes": {
                  "type": "string"
                }
              }
            }
          },
          "evidence": {
            "type": "array",
            "items": {
              "type": "string",
              "minLength": 1
            },
            "minItems": 1
          }
        }
      }
    },
    "exit_gate": {
      "type": "object",
      "additionalProperties": false,
      "required": [
        "rule",
        "required_priorities",
        "required_evidence",
        "decision_owner"
      ],
      "properties": {
        "rule": {
          "enum": [
            "all_required_pass",
            "all_blocker_and_critical_pass"
          ]
        },
        "required_priorities": {
          "type": "array",
          "items": {
            "enum": [
              "blocker",
              "critical",
              "major",
              "minor"
            ]
          },
          "minItems": 1
        },
        "required_evidence": {
          "type": "array",
          "items": {
            "type": "string",
            "minLength": 1
          },
          "minItems": 1
        },
        "decision_owner": {
          "type": "string",
          "minLength": 1
        },
        "notes": {
          "type": "array",
          "items": {
            "type": "string"
          }
        }
      }
    }
  }
}
